{
  "$schema": "https://json-schema.org/draft/2020-12/schema",
  "$id": "https://video-project.local/schema/series.schema.json",
  "title": "series.json",
  "type": "object",
  "additionalProperties": false,
  "required": [
    "schemaVersion",
    "id",
    "title",
    "description",
    "episodes"
  ],
  "properties": {
    "schemaVersion": {
      "const": 1
    },
    "id": {
      "type": "string",
      "pattern": "^[a-z][a-z0-9-]*$"
    },
    "title": {
      "type": "string",
      "minLength": 1
    },
    "description": {
      "type": "string",
      "minLength": 1
    },
    "thesis": {
      "type": "string"
    },
    "episodes": {
      "type": "array",
      "minItems": 1,
      "items": {
        "type": "string",
        "pattern": "^[0-9]{2}-[a-z0-9-]+$"
      }
    },
    "productionOrder": {
      "type": "array",
      "items": {
        "type": "string"
      }
    },
    "docs": {
      "type": "array",
      "items": {
        "type": "string"
      }
    }
  }
}
